{"schema": "awr.sandbox.template.v1", "template_id": "t1_point_watch", "world_id": "shenzhen", "name_zh": "测试模板 t1_point_watch", "summary_zh": "测试用模板", "recommended": false, "calendar_default": {"start_local": "10:00", "tz": "Asia/Shanghai"}, "acoustic_bg": "urban", "nests": [], "vehicles": [{"id": "p600-01", "model_id": "p600_mid360", "home_enu_m": [0, 0, 0]}], "targets": [], "tasks": []}
