{
  "schema": "awr.sandbox.template.v1",
  "template_id": "t4_scan_gsd",
  "world_id": "sanfrancisco",
  "name_zh": "T4 GSD 完整扫描",
  "summary_zh": "4 架 P600 按 3 cm GSD 扫描验证区：先给出架数与完工曲线，20 s 后开始执行",
  "first_feedback_zh": "架数与完工曲线",
  "recommended": false,
  "calendar_default": {"start_local": "10:00", "tz": "America/Los_Angeles"},
  "acoustic_bg": "urban",
  "env": {"preset": "clear", "overrides": {}},
  "seed": 14,
  "nests": [
    {
      "id": "nest-a",
      "name": "机巢箱 A",
      "pos": [-375.1, -295.9, -15.66],
      "kind": "box",
      "slots": 4,
      "energy": {"mode": "swap", "swap_s": 180, "packs": [{"cells": 6, "count": 4, "capacity_ah": 10}]},
      "chargers": [{"model": "c1_xr", "count": 4, "channels": 1, "i_max_a": 10, "cells_max": 6}],
      "turnaround_s": 60,
      "launch_interval_s": 30,
      "link_range_m": 3500
    }
  ],
  "vehicles": [
    {"id": "p600-01", "model_id": "p600_mid360", "nest_id": "nest-a", "label": "P600 一号"},
    {"id": "p600-02", "model_id": "p600_mid360", "nest_id": "nest-a", "label": "P600 二号"},
    {"id": "p600-03", "model_id": "p600_mid360", "nest_id": "nest-a", "label": "P600 三号"},
    {"id": "p600-04", "model_id": "p600_mid360", "nest_id": "nest-a", "label": "P600 四号"}
  ],
  "targets": [],
  "tasks": [
    {
      "type": "area_scan_gsd",
      "label": "GSD 完整扫描",
      "params": {
        "polygon": [[-590.3, -412.1], [-430.3, -412.1], [-430.3, -252.1], [-590.3, -252.1]],
        "gsd_cm": 3.0,
        "sidelap": 0.2,
        "frontlap": 0.2,
        "theta_max_deg": 15,
        "h_cap_m": 120,
        "n_vehicles": "auto",
        "allow_multi_sortie": false
      },
      "common": {"priority": "normal", "start_at_s": 20, "on_detect": "notify"}
    }
  ],
  "camera": {"center_enu_m": [-361, 20, 0], "range_m": 900, "pitch_deg": -40, "yaw_deg": 0},
  "anchors_ref": "scenarios/sandbox/anchors/sanfrancisco.json"
}
