{
  "schema": "awr.sandbox.template.v1",
  "template_id": "t8_scene_activity",
  "world_id": "synthcity",
  "name_zh": "T8 场景约束步行（实验）",
  "summary_zh": "6 名行人按 seed 生成跨街区目的地与停留；受人行道和过街通道约束。车辆交通尚未接入。",
  "first_feedback_zh": "选择行人：查看目的地、活动阶段与路线",
  "recommended": false,
  "calendar_default": {
    "start_local": "10:00",
    "tz": "Asia/Shanghai"
  },
  "acoustic_bg": "urban",
  "env": {
    "preset": "clear",
    "overrides": {}
  },
  "seed": 20261022,
  "camera": {
    "center_enu_m": [
      300,
      -120,
      0
    ],
    "range_m": 650,
    "pitch_deg": -40,
    "yaw_deg": 0
  },
  "anchors_ref": "scenarios/sandbox/anchors/synthcity.json",
  "vehicles": [],
  "nests": [],
  "tasks": [],
  "targets": [
    {
      "id": "walker-01",
      "label": "步行居民 01",
      "class": "person",
      "pos": [
        132.6,
        -287.4,
        0.15
      ],
      "motion": {
        "mode": "timeline"
      },
      "reaction_policy": "exogenous",
      "sensitivity": [],
      "sound": null,
      "size_m": {
        "l": 0.34131795167922974,
        "w": 0.6017975807189941,
        "h": 1.7666809558868408
      },
      "appearance": {
        "asset_id": "human-1",
        "geometry_sha256": "d4491b0e461d3ced14faa19808af5a3af47e6bcbaa3dacba5572dcfed9a5efc2"
      },
      "activity": {
        "plan_id": "walker-01",
        "sha256": "8c85c94038d2ba705dc77cf28683f575e7963c2b09998e3bf89ace7cdde3fb9f"
      }
    },
    {
      "id": "walker-02",
      "label": "步行居民 02",
      "class": "person",
      "pos": [
        107.4,
        -72.6,
        0.15
      ],
      "motion": {
        "mode": "timeline"
      },
      "reaction_policy": "exogenous",
      "sensitivity": [],
      "sound": null,
      "size_m": {
        "l": 0.27933183312416077,
        "w": 0.4678380489349365,
        "h": 1.499302625656128
      },
      "appearance": {
        "asset_id": "human-3",
        "geometry_sha256": "1637558e0c555a5c54da8f87b93f3d3d360f2a67d2ab93e412e8fa0ccefee051"
      },
      "activity": {
        "plan_id": "walker-02",
        "sha256": "96d0fee43e3881268c8ba56727b53a16dee9c7b4025ab4a3687c819ac92db210"
      }
    },
    {
      "id": "walker-03",
      "label": "步行居民 03",
      "class": "person",
      "pos": [
        223.4,
        -167.4,
        0.15
      ],
      "motion": {
        "mode": "timeline"
      },
      "reaction_policy": "exogenous",
      "sensitivity": [],
      "sound": null,
      "size_m": {
        "l": 0.34131795167922974,
        "w": 0.6017975807189941,
        "h": 1.7666809558868408
      },
      "appearance": {
        "asset_id": "human-1",
        "geometry_sha256": "d4491b0e461d3ced14faa19808af5a3af47e6bcbaa3dacba5572dcfed9a5efc2"
      },
      "activity": {
        "plan_id": "walker-03",
        "sha256": "4ee6e7b4478e2872e55f17962b6fe5335afad608ca95e172fd37847a4069bc93"
      }
    },
    {
      "id": "walker-04",
      "label": "步行居民 04",
      "class": "person",
      "pos": [
        347.4,
        43.4,
        0.15
      ],
      "motion": {
        "mode": "timeline"
      },
      "reaction_policy": "exogenous",
      "sensitivity": [],
      "sound": null,
      "size_m": {
        "l": 0.27933183312416077,
        "w": 0.4678380489349365,
        "h": 1.499302625656128
      },
      "appearance": {
        "asset_id": "human-3",
        "geometry_sha256": "1637558e0c555a5c54da8f87b93f3d3d360f2a67d2ab93e412e8fa0ccefee051"
      },
      "activity": {
        "plan_id": "walker-04",
        "sha256": "78d50387273b79062bcf1fc0f02340bb5d2b8822a38a190772f5b538a7c5bfbe"
      }
    },
    {
      "id": "walker-05",
      "label": "步行居民 05",
      "class": "person",
      "pos": [
        372.6,
        -167.4,
        0.15
      ],
      "motion": {
        "mode": "timeline"
      },
      "reaction_policy": "exogenous",
      "sensitivity": [],
      "sound": null,
      "size_m": {
        "l": 0.34131795167922974,
        "w": 0.6017975807189941,
        "h": 1.7666809558868408
      },
      "appearance": {
        "asset_id": "human-1",
        "geometry_sha256": "d4491b0e461d3ced14faa19808af5a3af47e6bcbaa3dacba5572dcfed9a5efc2"
      },
      "activity": {
        "plan_id": "walker-05",
        "sha256": "b3e24780516c37fba7365a68f84b6dadb8637b24a8163ea94486ddbdfeed853e"
      }
    },
    {
      "id": "walker-06",
      "label": "步行居民 06",
      "class": "person",
      "pos": [
        347.4,
        76.6,
        0.15
      ],
      "motion": {
        "mode": "timeline"
      },
      "reaction_policy": "exogenous",
      "sensitivity": [],
      "sound": null,
      "size_m": {
        "l": 0.27933183312416077,
        "w": 0.4678380489349365,
        "h": 1.499302625656128
      },
      "appearance": {
        "asset_id": "human-3",
        "geometry_sha256": "1637558e0c555a5c54da8f87b93f3d3d360f2a67d2ab93e412e8fa0ccefee051"
      },
      "activity": {
        "plan_id": "walker-06",
        "sha256": "b11afd316b73498b7ba4692f31f33e119d68ab9e72107d1c872e17ffb4309541"
      }
    }
  ]
}
