{"schema": "awr.sandbox.template.v1", "template_id": "t5_area_guard", "world_id": "synthcity", "name_zh": "测试模板 t5_area_guard", "summary_zh": "测试用模板", "recommended": true, "calendar_default": {"start_local": "10:00", "tz": "Asia/Shanghai"}, "acoustic_bg": "urban", "nests": [], "vehicles": [{"id": "p600-01", "model_id": "p600_mid360", "home_enu_m": [0, 0, 0]}], "targets": [], "tasks": []}
